{
 "table": "barrage-results",
 "sources": ["CNA1979:12.6", "scan:p96"],
 "notes": [
  "Columns are actual barrage points applied to the target after any terrain row shift (SPI 12.33); the printed chart reads these as columns and the results as rows, transposed here so that one record is one cell",
  "Dice are the sequential two-dice reading (SPI 11.4): first die tens, second die units, 11-16, 21-26, ... 61-66",
  "pinned: the target battalion-equivalent may not retreat before assault or take part in the assault (SPI 12.44). lose-1 / lose-2: lose that many TOE strength points; infantry and armor are also pinned. Infantry carried in trucks loses one truck point as well (chart footnote)",
  "Transcribed from the archive.org scan (jp2 96) and cross-checked cell by cell against the 300 dpi community scan of the chart sheet (scan:discord:Shared Charts.pdf:p2); 0 of 108 cells differ. Clay Stone's errata-integrated Land rules PDF contains no chart sheet, so it could not be used for this table"
 ],
 "columns": [
  {"id": "1-2", "min": 1, "max": 2},
  {"id": "3-4", "min": 3, "max": 4},
  {"id": "5-6", "min": 5, "max": 6},
  {"id": "7-8", "min": 7, "max": 8},
  {"id": "9-10", "min": 9, "max": 10},
  {"id": "11-12", "min": 11, "max": 12},
  {"id": "13-14", "min": 13, "max": 14},
  {"id": "15-16", "min": 15, "max": 16},
  {"id": "17+", "min": 17, "max": null}
 ],
 "rows": [
  {"class": "infantry", "column": "1-2", "result": "no-effect", "dice": {"from": 11, "to": 53}, "sources": ["CNA1979:12.6", "scan:p96"]},
  {"class": "infantry", "column": "3-4", "result": "no-effect", "dice": {"from": 11, "to": 44}, "sources": ["CNA1979:12.6", "scan:p96"]},
  {"class": "infantry", "column": "5-6", "result": "no-effect", "dice": {"from": 11, "to": 41}, "sources": ["CNA1979:12.6", "scan:p96"]},
  {"class": "infantry", "column": "7-8", "result": "no-effect", "dice": {"from": 11, "to": 34}, "sources": ["CNA1979:12.6", "scan:p96"]},
  {"class": "infantry", "column": "9-10", "result": "no-effect", "dice": {"from": 11, "to": 24}, "sources": ["CNA1979:12.6", "scan:p96"]},
  {"class": "infantry", "column": "11-12", "result": "no-effect", "dice": {"from": 11, "to": 16}, "sources": ["CNA1979:12.6", "scan:p96"]},
  {"class": "infantry", "column": "1-2", "result": "pinned", "dice": {"from": 54, "to": 66}, "sources": ["CNA1979:12.6", "scan:p96"]},
  {"class": "infantry", "column": "3-4", "result": "pinned", "dice": {"from": 45, "to": 66}, "sources": ["CNA1979:12.6", "scan:p96"]},
  {"class": "infantry", "column": "5-6", "result": "pinned", "dice": {"from": 42, "to": 65}, "sources": ["CNA1979:12.6", "scan:p96"]},
  {"class": "infantry", "column": "7-8", "result": "pinned", "dice": {"from": 35, "to": 64}, "sources": ["CNA1979:12.6", "scan:p96"]},
  {"class": "infantry", "column": "9-10", "result": "pinned", "dice": {"from": 25, "to": 61}, "sources": ["CNA1979:12.6", "scan:p96"]},
  {"class": "infantry", "column": "11-12", "result": "pinned", "dice": {"from": 21, "to": 44}, "sources": ["CNA1979:12.6", "scan:p96"]},
  {"class": "infantry", "column": "13-14", "result": "pinned", "dice": {"from": 11, "to": 35}, "sources": ["CNA1979:12.6", "scan:p96"]},
  {"class": "infantry", "column": "15-16", "result": "pinned", "dice": {"from": 11, "to": 32}, "sources": ["CNA1979:12.6", "scan:p96"]},
  {"class": "infantry", "column": "17+", "result": "pinned", "dice": {"from": 11, "to": 31}, "sources": ["CNA1979:12.6", "scan:p96"]},
  {"class": "infantry", "column": "5-6", "result": "lose-1", "dice": {"from": 66, "to": 66}, "sources": ["CNA1979:12.6", "scan:p96"]},
  {"class": "infantry", "column": "7-8", "result": "lose-1", "dice": {"from": 65, "to": 66}, "sources": ["CNA1979:12.6", "scan:p96"]},
  {"class": "infantry", "column": "9-10", "result": "lose-1", "dice": {"from": 62, "to": 66}, "sources": ["CNA1979:12.6", "scan:p96"]},
  {"class": "infantry", "column": "11-12", "result": "lose-1", "dice": {"from": 45, "to": 66}, "sources": ["CNA1979:12.6", "scan:p96"]},
  {"class": "infantry", "column": "13-14", "result": "lose-1", "dice": {"from": 36, "to": 64}, "sources": ["CNA1979:12.6", "scan:p96"]},
  {"class": "infantry", "column": "15-16", "result": "lose-1", "dice": {"from": 33, "to": 56}, "sources": ["CNA1979:12.6", "scan:p96"]},
  {"class": "infantry", "column": "17+", "result": "lose-1", "dice": {"from": 32, "to": 55}, "sources": ["CNA1979:12.6", "scan:p96"]},
  {"class": "infantry", "column": "13-14", "result": "lose-2", "dice": {"from": 65, "to": 66}, "sources": ["CNA1979:12.6", "scan:p96"]},
  {"class": "infantry", "column": "15-16", "result": "lose-2", "dice": {"from": 61, "to": 66}, "sources": ["CNA1979:12.6", "scan:p96"]},
  {"class": "infantry", "column": "17+", "result": "lose-2", "dice": {"from": 56, "to": 66}, "sources": ["CNA1979:12.6", "scan:p96"]},
  {"class": "armor", "column": "1-2", "result": "no-effect", "dice": {"from": 11, "to": 62}, "sources": ["CNA1979:12.6", "scan:p96"]},
  {"class": "armor", "column": "3-4", "result": "no-effect", "dice": {"from": 11, "to": 54}, "sources": ["CNA1979:12.6", "scan:p96"]},
  {"class": "armor", "column": "5-6", "result": "no-effect", "dice": {"from": 11, "to": 45}, "sources": ["CNA1979:12.6", "scan:p96"]},
  {"class": "armor", "column": "7-8", "result": "no-effect", "dice": {"from": 11, "to": 36}, "sources": ["CNA1979:12.6", "scan:p96"]},
  {"class": "armor", "column": "9-10", "result": "no-effect", "dice": {"from": 11, "to": 31}, "sources": ["CNA1979:12.6", "scan:p96"]},
  {"class": "armor", "column": "11-12", "result": "no-effect", "dice": {"from": 11, "to": 22}, "sources": ["CNA1979:12.6", "scan:p96"]},
  {"class": "armor", "column": "13-14", "result": "no-effect", "dice": {"from": 11, "to": 14}, "sources": ["CNA1979:12.6", "scan:p96"]},
  {"class": "armor", "column": "1-2", "result": "pinned", "dice": {"from": 63, "to": 66}, "sources": ["CNA1979:12.6", "scan:p96"]},
  {"class": "armor", "column": "3-4", "result": "pinned", "dice": {"from": 55, "to": 66}, "sources": ["CNA1979:12.6", "scan:p96"]},
  {"class": "armor", "column": "5-6", "result": "pinned", "dice": {"from": 46, "to": 66}, "sources": ["CNA1979:12.6", "scan:p96"]},
  {"class": "armor", "column": "7-8", "result": "pinned", "dice": {"from": 41, "to": 66}, "sources": ["CNA1979:12.6", "scan:p96"]},
  {"class": "armor", "column": "9-10", "result": "pinned", "dice": {"from": 32, "to": 66}, "sources": ["CNA1979:12.6", "scan:p96"]},
  {"class": "armor", "column": "11-12", "result": "pinned", "dice": {"from": 23, "to": 66}, "sources": ["CNA1979:12.6", "scan:p96"]},
  {"class": "armor", "column": "13-14", "result": "pinned", "dice": {"from": 15, "to": 63}, "sources": ["CNA1979:12.6", "scan:p96"]},
  {"class": "armor", "column": "15-16", "result": "pinned", "dice": {"from": 11, "to": 62}, "sources": ["CNA1979:12.6", "scan:p96"]},
  {"class": "armor", "column": "17+", "result": "pinned", "dice": {"from": 11, "to": 54}, "sources": ["CNA1979:12.6", "scan:p96"]},
  {"class": "armor", "column": "13-14", "result": "lose-1", "dice": {"from": 64, "to": 66}, "sources": ["CNA1979:12.6", "scan:p96"]},
  {"class": "armor", "column": "15-16", "result": "lose-1", "dice": {"from": 63, "to": 66}, "sources": ["CNA1979:12.6", "scan:p96"]},
  {"class": "armor", "column": "17+", "result": "lose-1", "dice": {"from": 55, "to": 66}, "sources": ["CNA1979:12.6", "scan:p96"]},
  {"class": "gun", "column": "1-2", "result": "no-effect", "dice": {"from": 11, "to": 61}, "sources": ["CNA1979:12.6", "scan:p96"]},
  {"class": "gun", "column": "3-4", "result": "no-effect", "dice": {"from": 11, "to": 54}, "sources": ["CNA1979:12.6", "scan:p96"]},
  {"class": "gun", "column": "5-6", "result": "no-effect", "dice": {"from": 11, "to": 46}, "sources": ["CNA1979:12.6", "scan:p96"]},
  {"class": "gun", "column": "7-8", "result": "no-effect", "dice": {"from": 11, "to": 36}, "sources": ["CNA1979:12.6", "scan:p96"]},
  {"class": "gun", "column": "9-10", "result": "no-effect", "dice": {"from": 11, "to": 26}, "sources": ["CNA1979:12.6", "scan:p96"]},
  {"class": "gun", "column": "11-12", "result": "no-effect", "dice": {"from": 11, "to": 22}, "sources": ["CNA1979:12.6", "scan:p96"]},
  {"class": "gun", "column": "13-14", "result": "no-effect", "dice": {"from": 11, "to": 12}, "sources": ["CNA1979:12.6", "scan:p96"]},
  {"class": "gun", "column": "1-2", "result": "lose-1", "dice": {"from": 62, "to": 66}, "sources": ["CNA1979:12.6", "scan:p96"]},
  {"class": "gun", "column": "3-4", "result": "lose-1", "dice": {"from": 55, "to": 66}, "sources": ["CNA1979:12.6", "scan:p96"]},
  {"class": "gun", "column": "5-6", "result": "lose-1", "dice": {"from": 51, "to": 66}, "sources": ["CNA1979:12.6", "scan:p96"]},
  {"class": "gun", "column": "7-8", "result": "lose-1", "dice": {"from": 41, "to": 66}, "sources": ["CNA1979:12.6", "scan:p96"]},
  {"class": "gun", "column": "9-10", "result": "lose-1", "dice": {"from": 31, "to": 66}, "sources": ["CNA1979:12.6", "scan:p96"]},
  {"class": "gun", "column": "11-12", "result": "lose-1", "dice": {"from": 23, "to": 64}, "sources": ["CNA1979:12.6", "scan:p96"]},
  {"class": "gun", "column": "13-14", "result": "lose-1", "dice": {"from": 13, "to": 56}, "sources": ["CNA1979:12.6", "scan:p96"]},
  {"class": "gun", "column": "15-16", "result": "lose-1", "dice": {"from": 11, "to": 54}, "sources": ["CNA1979:12.6", "scan:p96"]},
  {"class": "gun", "column": "17+", "result": "lose-1", "dice": {"from": 11, "to": 36}, "sources": ["CNA1979:12.6", "scan:p96"]},
  {"class": "gun", "column": "11-12", "result": "lose-2", "dice": {"from": 65, "to": 66}, "sources": ["CNA1979:12.6", "scan:p96"]},
  {"class": "gun", "column": "13-14", "result": "lose-2", "dice": {"from": 61, "to": 66}, "sources": ["CNA1979:12.6", "scan:p96"]},
  {"class": "gun", "column": "15-16", "result": "lose-2", "dice": {"from": 55, "to": 66}, "sources": ["CNA1979:12.6", "scan:p96"]},
  {"class": "gun", "column": "17+", "result": "lose-2", "dice": {"from": 41, "to": 66}, "sources": ["CNA1979:12.6", "scan:p96"]},